{"schema_version":"llmnpc.skeleton_capability.v1","profile_id":"ue5_manny.v1","profile_semantic_version":"1.1.1","skeleton_signature":"md5:6b1ff1901c28611b8c817ec9c968a58f","control_manifest_version":"llmnpc.control_manifest.v1","capability_hash":"md5:9a0b995dac43d28ce4a674fa79d6d532","generated_at":"2026-07-25T03:13:42.572Z","capabilities":[{"capability_id":"arm.present","body_region":"arms","supported_sides":["left","right"],"parameter_ranges":{"amplitude":{"type":"normalized_float","unit":"normalized","min":0.20000000000000001,"max":1},"duration":{"type":"seconds","unit":"seconds","min":0.20000000000000001,"max":4},"height":{"type":"normalized_float","unit":"normalized","min":0,"max":1}},"requires":["hand.pose.open"],"conflicts_with":[],"target_modes":["direction","scene_target"],"runtime_recipe_allowed":true,"authoring_only":false,"description":"Extend one arm with an open palm to present a person, object, or direction."},{"capability_id":"arm.reach","body_region":"arms","supported_sides":["left","right"],"parameter_ranges":{"duration":{"type":"seconds","unit":"seconds","min":0.20000000000000001,"max":4},"height":{"type":"normalized_float","unit":"normalized","min":0,"max":1},"reach":{"type":"normalized_float","unit":"normalized","min":0.050000000000000003,"max":0.97999999999999998}},"requires":[],"conflicts_with":["left_hand_busy","right_hand_busy","two_hand_interaction"],"target_modes":["direction","scene_target"],"runtime_recipe_allowed":true,"authoring_only":false,"description":"Move one hand toward a validated target within the configured reach envelope."},{"capability_id":"chest.lean","body_region":"chest","supported_sides":["center"],"parameter_ranges":{"amplitude":{"type":"normalized_float","unit":"normalized","min":0.20000000000000001,"max":1},"duration":{"type":"seconds","unit":"seconds","min":0.20000000000000001,"max":4},"speed":{"type":"speed_multiplier","unit":"multiplier","min":0.59999999999999998,"max":1.3999999999999999}},"requires":[],"conflicts_with":[],"target_modes":["none","scene_target"],"runtime_recipe_allowed":true,"authoring_only":false,"description":"Apply a small upper-body lean without moving the pelvis or feet."},{"capability_id":"chest.turn","body_region":"chest","supported_sides":["left","right"],"parameter_ranges":{"amplitude":{"type":"normalized_float","unit":"normalized","min":0.20000000000000001,"max":1},"duration":{"type":"seconds","unit":"seconds","min":0.20000000000000001,"max":4},"speed":{"type":"speed_multiplier","unit":"multiplier","min":0.59999999999999998,"max":1.3999999999999999}},"requires":[],"conflicts_with":[],"target_modes":["none","scene_target"],"runtime_recipe_allowed":true,"authoring_only":false,"description":"Apply a small upper-body turn while locomotion retains lower-body ownership."},{"capability_id":"gaze.track","body_region":"gaze","supported_sides":["center"],"parameter_ranges":{"duration":{"type":"seconds","unit":"seconds","min":0.20000000000000001,"max":4},"engagement":{"type":"normalized_float","unit":"normalized","min":0,"max":1}},"requires":[],"conflicts_with":[],"target_modes":["scene_target"],"runtime_recipe_allowed":true,"authoring_only":false,"description":"Track a validated scene target with constrained head and gaze motion."},{"capability_id":"hand.pose.curl","body_region":"hands","supported_sides":["left","right"],"parameter_ranges":{"weight":{"type":"normalized_float","unit":"normalized","min":0,"max":1}},"requires":[],"conflicts_with":[],"target_modes":["none"],"runtime_recipe_allowed":true,"authoring_only":false,"description":"Curl the selected fingers within the calibrated safe pose."},{"capability_id":"hand.pose.open","body_region":"hands","supported_sides":["left","right"],"parameter_ranges":{"weight":{"type":"normalized_float","unit":"normalized","min":0,"max":1}},"requires":[],"conflicts_with":[],"target_modes":["none"],"runtime_recipe_allowed":true,"authoring_only":false,"description":"Blend the selected hand toward the calibrated open-palm pose."},{"capability_id":"hand.pose.point","body_region":"hands","supported_sides":["left","right"],"parameter_ranges":{"weight":{"type":"normalized_float","unit":"normalized","min":0,"max":1}},"requires":[],"conflicts_with":[],"target_modes":["none"],"runtime_recipe_allowed":true,"authoring_only":false,"description":"Blend the selected hand toward the calibrated pointing pose."},{"capability_id":"hand.pose.relaxed","body_region":"hands","supported_sides":["left","right"],"parameter_ranges":{"weight":{"type":"normalized_float","unit":"normalized","min":0,"max":1}},"requires":[],"conflicts_with":[],"target_modes":["none"],"runtime_recipe_allowed":true,"authoring_only":false,"description":"Blend the selected hand toward a natural relaxed finger pose."},{"capability_id":"hand.wave_arc","body_region":"hands","supported_sides":["left","right"],"parameter_ranges":{"amplitude":{"type":"normalized_float","unit":"normalized","min":0.20000000000000001,"max":1},"cycles":{"type":"integer","unit":"count","min":1,"max":4},"height":{"type":"normalized_float","unit":"normalized","min":0.25,"max":0.90000000000000002},"speed":{"type":"speed_multiplier","unit":"multiplier","min":0.59999999999999998,"max":1.3999999999999999}},"requires":["arm.reach","hand.pose.open"],"conflicts_with":["left_hand_busy","right_hand_busy","two_hand_interaction"],"target_modes":["none","scene_target"],"runtime_recipe_allowed":true,"authoring_only":false,"description":"Raise one hand and move it laterally in a greeting or farewell arc."},{"capability_id":"head.nod","body_region":"head","supported_sides":["center"],"parameter_ranges":{"amplitude":{"type":"normalized_float","unit":"normalized","min":0.20000000000000001,"max":1},"cycles":{"type":"integer","unit":"count","min":1,"max":4},"duration":{"type":"seconds","unit":"seconds","min":0.20000000000000001,"max":4},"speed":{"type":"speed_multiplier","unit":"multiplier","min":0.59999999999999998,"max":1.3999999999999999}},"requires":[],"conflicts_with":[],"target_modes":["none"],"runtime_recipe_allowed":true,"authoring_only":false,"description":"Move the head vertically to acknowledge, agree, or encourage."},{"capability_id":"head.shake","body_region":"head","supported_sides":["center"],"parameter_ranges":{"amplitude":{"type":"normalized_float","unit":"normalized","min":0.20000000000000001,"max":1},"cycles":{"type":"integer","unit":"count","min":1,"max":4},"duration":{"type":"seconds","unit":"seconds","min":0.20000000000000001,"max":4},"speed":{"type":"speed_multiplier","unit":"multiplier","min":0.59999999999999998,"max":1.3999999999999999}},"requires":[],"conflicts_with":[],"target_modes":["none"],"runtime_recipe_allowed":true,"authoring_only":false,"description":"Move the head laterally to disagree, refuse, or express uncertainty."},{"capability_id":"head.tilt","body_region":"head","supported_sides":["center"],"parameter_ranges":{"amplitude":{"type":"normalized_float","unit":"normalized","min":0.20000000000000001,"max":1},"cycles":{"type":"integer","unit":"count","min":1,"max":4},"duration":{"type":"seconds","unit":"seconds","min":0.20000000000000001,"max":4},"speed":{"type":"speed_multiplier","unit":"multiplier","min":0.59999999999999998,"max":1.3999999999999999}},"requires":[],"conflicts_with":[],"target_modes":["none"],"runtime_recipe_allowed":true,"authoring_only":false,"description":"Tilt the head to show curiosity, sympathy, or uncertainty."},{"capability_id":"hold","body_region":"upper_body","supported_sides":["center"],"parameter_ranges":{"duration":{"type":"seconds","unit":"seconds","min":0.050000000000000003,"max":2}},"requires":[],"conflicts_with":[],"target_modes":["none"],"runtime_recipe_allowed":true,"authoring_only":false,"description":"Hold the current recipe phase for a bounded duration."},{"capability_id":"shoulder.shrug","body_region":"shoulders","supported_sides":["both","left","right"],"parameter_ranges":{"amplitude":{"type":"normalized_float","unit":"normalized","min":0.20000000000000001,"max":1},"duration":{"type":"seconds","unit":"seconds","min":0.20000000000000001,"max":4},"speed":{"type":"speed_multiplier","unit":"multiplier","min":0.59999999999999998,"max":1.3999999999999999}},"requires":[],"conflicts_with":[],"target_modes":["none"],"runtime_recipe_allowed":true,"authoring_only":false,"description":"Raise one or both shoulders to express uncertainty, indifference, or lack of knowledge."}],"global_limits":{"max_action_duration_seconds":4,"max_primitive_count":12,"allowed_body_regions":["head","gaze","chest","shoulders","arms","hands"],"allows_lower_body":false,"allows_root_motion":false}}